{
  "$schema": "https://json-schema.org/draft/2020-12/schema",
  "title": "FarDriver telemetry field",
  "type": "object",
  "required": ["frame", "offset", "key", "name", "type", "scale", "unit", "group", "enum", "explain", "confidence", "source"],
  "additionalProperties": false,
  "properties": {
    "frame": { "type": "string", "pattern": "^0x[0-9A-F]{2}$" },
    "offset": { "type": "integer", "minimum": 0 },
    "key": { "type": "string", "pattern": "^[a-z][a-z0-9_]*$" },
    "name": { "type": "string", "minLength": 1 },
    "type": { "enum": ["u8", "i8", "u16", "i16", "u32", "i32", "bitfield", "enum"] },
    "scale": { "type": "number", "exclusiveMinimum": 0 },
    "unit": { "type": "string" },
    "group": { "type": "string", "pattern": "^[a-z][a-z0-9_]*$" },
    "enum": {
      "oneOf": [
        { "type": "null" },
        { "type": "object", "patternProperties": { "^[0-9]+$": { "type": "string" } }, "additionalProperties": false }
      ]
    },
    "explain": { "type": "string", "minLength": 20 },
    "confidence": { "enum": ["high", "medium", "low"] },
    "source": { "type": "array", "minItems": 1, "items": { "type": "string", "pattern": "^(official|worthless|gdriver):" } },
    "notes": { "type": "string" }
  }
}
